{
  "schemaVersion": 1,
  "id": "media-3",
  "episodeID": "episode-3",
  "durationMs": 180000,
  "identityStatus": "verified",
  "contentHash": "daed10599a8f7da1eff2df8e13e949c8d8f60a7d1729fd086a4494bd33866b9e",
  "rightsBasis": "syntheticFixture",
  "capabilities": {
    "nativeAudio": true,
    "visibleVideo": false,
    "analyzeText": true,
    "analyzeAudio": true,
    "timedPlayback": true,
    "reasonCodes": []
  }
}
