{
  "schemaVersion": 1,
  "id": "media-2",
  "episodeID": "episode-2",
  "durationMs": 180000,
  "identityStatus": "verified",
  "contentHash": "4555ef70f2f066f4043465a63b111f04a3838c3492a41205cfb45309c3f7560b",
  "rightsBasis": "syntheticFixture",
  "capabilities": {
    "nativeAudio": true,
    "visibleVideo": false,
    "analyzeText": true,
    "analyzeAudio": true,
    "timedPlayback": true,
    "reasonCodes": []
  }
}
