{
  "schemaVersion": 1,
  "id": "media-4",
  "episodeID": "episode-4",
  "durationMs": 180000,
  "identityStatus": "verified",
  "contentHash": "c29ecb26e68cdcb20c1c3d4eef3021a50be30bd92b6e987d724e571b8bedb629",
  "rightsBasis": "syntheticFixture",
  "capabilities": {
    "nativeAudio": true,
    "visibleVideo": false,
    "analyzeText": true,
    "analyzeAudio": true,
    "timedPlayback": true,
    "reasonCodes": []
  }
}
